{
 "schema": "ky.launch_config/1",
 "engine": "codex",
 "role": "area-reviewer",
 "model": "gpt-6.1-sol",
 "effort": "high",
 "sandbox": "workspace-write",
 "network": false,
 "work_root": "job",
 "deadline_seconds": 7200,
 "worktree": "/Users/Dev/worktrees.noindex/madhav/claude/kalayantra-relaunch-plan",
 "codex_bin": "/opt/homebrew/bin/codex",
 "codex_min_version": "0.162.0",
 "prompt_path": "/Users/Dev/worktrees.noindex/madhav/claude/kalayantra-relaunch-plan/00_ARCHITECTURE/briefs/kalayantra/fleet/cards/BOOTSTRAP_REVIEWER.md",
 "output_schema": "/Users/Dev/worktrees.noindex/madhav/claude/kalayantra-relaunch-plan/00_ARCHITECTURE/briefs/kalayantra/fleet/schemas/codex_reviewer_output.json",
 "env_names": [
  "HOME",
  "USER",
  "LANG",
  "TERM",
  "PATH",
  "TMPDIR",
  "ZDOTDIR",
  "KY_ROOT",
  "KY_RUN",
  "KY_SCRATCH",
  "JOB_SCRATCH",
  "KY_ITEM",
  "KY_PY"
 ],
 "child_path": "/Users/Dev/kalayantra/bin:/opt/homebrew/bin:/usr/bin:/bin",
 "writable_dirs": [],
 "_note": "The Codex area reviewer (the bootstrap reviewer with twice the time, for the B-0c area reviews) (cockpit ruling E1): workspace-write rooted in its own job folder (-C <JOB_DIR>, the only writable root, network off) — it writes result.json and its test temp files there, as the card says; final_message.txt (held to codex_reviewer_output.json) is a fallback only. The item's working copy is read by absolute path (ITEM_WORKTREE=<path> in the prompt) and kyboot.py fails the job if its HEAD or git status changed. Reviewers' test runs: `python3 -B -m pytest -p no:cacheprovider --basetemp=$JOB_SCRATCH/pytest …` (the item's working copy is read-only to the job: no compiled cache, no pytest cache there). Model gpt-6.1-sol at effort high (owner decision 2026-10-12)."
}
