{
 "schema": "ky.launch_config/1",
 "engine": "codex",
 "role": "verify",
 "model": "gpt-6.1-sol",
 "effort": "high",
 "sandbox": "workspace-write",
 "network": false,
 "work_root": "job",
 "deadline_seconds": 3600,
 "worktree": "/Users/Dev/worktrees.noindex/madhav/claude/kalayantra-campaign",
 "codex_bin": "/opt/homebrew/bin/codex",
 "codex_min_version": "0.162.0",
 "prompt_path": "/Users/Dev/kalayantra/fleet_live/cards/PARIKSAKA.md",
 "output_schema": "/Users/Dev/kalayantra/fleet_live/schemas/codex_reviewer_output.json",
 "env_names": [
  "HOME",
  "PATH",
  "LANG",
  "TERM",
  "USER",
  "TMPDIR",
  "ZDOTDIR",
  "KY_ROOT",
  "KY_RUN",
  "KY_FLEET",
  "KY_STREAM",
  "KY_LANE",
  "KY_ITEM",
  "KY_PY",
  "KY_SCRATCH",
  "JOB_SCRATCH",
  "KY_RUN_ID",
  "KY_ROLE",
  "KY_CONTROLLER_ID"
 ],
 "child_path": "/Users/Dev/kalayantra/bin:/Users/Dev/.nvm/versions/node/v24.14.0/bin:/opt/homebrew/bin:/usr/bin:/bin",
 "writable_dirs": [],
 "_note": "Verifier uses native Codex workspace-write, network off, -C JOB_SCRATCH, no added writable roots and job-local CODEX_HOME. kyboundary prepares a sibling read-only view outside that root and validates the native launch without an outer Seatbelt wrapper. Qualification measures source/Git write refusal, source reads and job writes using exactly this arrangement. Requalify after installation; no old outer-boundary receipt authorises launch."
}
